<?xml version="1.0" encoding="UTF-8"?>
<reserva xmlns="http://www.visitaOpaiNatal.pt/reservaTypes" xmlns:xsi="http://www.w3.org/2001/XMLSchema-instance" xsi:schemaLocation="http://www.visitaOpaiNatal.pt/reservaTypes reservaTypes.xsd">
    <familia>
        <origem>
            <país>United Kingdom</país>
            <cidade>London</cidade>
        </origem>
        <numElementos>4</numElementos>
        <elementos>
            <elemento>
                <genero>Masculino</genero>
                <primeiroNome>Pedro</primeiroNome>
                <segundoNome>Moreira</segundoNome>
                <dataNascimento>1999-03-14</dataNascimento>
            </elemento>
            <elemento>
                <genero>Feminino</genero>
                <primeiroNome>Marta</primeiroNome>
                <segundoNome>Silva</segundoNome>
                <dataNascimento>2008-10-25</dataNascimento>
            </elemento>
            <elemento>
                <genero>Masculino</genero>
                <primeiroNome>Marco</primeiroNome>
                <segundoNome>Sousa</segundoNome>
                <dataNascimento>2020-08-14</dataNascimento>
            </elemento>
            <elemento>
                <genero>Feminino</genero>
                <primeiroNome>Sonia</primeiroNome>
                <segundoNome>Moreira</segundoNome>
                <dataNascimento>2020-08-14</dataNascimento>
            </elemento>
        </elementos>
    </familia>
    <preferencias>
        <dataPrevista prioridade="1">2022-12-22</dataPrevista>
        <dataPrevista prioridade="2">2022-12-21</dataPrevista>
        <dataPrevista prioridade="3">2022-12-18</dataPrevista>
    </preferencias>
</reserva>